{
  "schemaVersion": 1,
  "run_id": "20260716T092904000Z__usgs-nas__a29ec4b24d48",
  "status": "complete",
  "started_at": "2026-07-16T09:29:04.000Z",
  "finished_at": "2026-07-16T09:29:04.000Z",
  "actor_type": "adapter",
  "actor_id": "usgs-nas-archive@1.0.0",
  "source_id": "usgs-nas",
  "source_registry_hash": "3ce14a61baea027f2e5c218f422735db362266906b80bc1edeb714526a65fd1f",
  "adapter_id": "usgs-nas-archive",
  "adapter_version": "1.0.0",
  "adapter_code_hash": "cfcbf64d560adb2d61140eba1f282136c6a4b9f4ff5dd6e0fe61403bac6c32f0",
  "code_commit": "9fda6edc17c95daafb609e1fa3c21654a306fb94",
  "parameter_hash": "68f6cab0365e42a998d60f7a16e6571f0d923c70b8ce15e5f4158a4c2e22c62f",
  "parameters": {
    "stateCode": "WA",
    "mode": "national-archive-replay",
    "nationalAcquisitionId": "20260531__usgs-nas-dwca-v1-344__563b13cbf2f8",
    "nationalAcquisitionReceiptSha256": "7d3a14c612282d77d8931d5a3b145aa1bcb70831cc7f28d4e57b22142a49ebb9",
    "archiveVersion": "1.344",
    "planId": "usgs-nas-national-v1-wave-05",
    "candidateLimit": 39,
    "candidatePairs": [
      "53001:corbicula-fluminea",
      "53003:corbicula-fluminea",
      "53005:corbicula-fluminea",
      "53007:corbicula-fluminea",
      "53009:corbicula-fluminea",
      "53011:corbicula-fluminea",
      "53013:corbicula-fluminea",
      "53015:corbicula-fluminea",
      "53017:corbicula-fluminea",
      "53019:corbicula-fluminea",
      "53021:corbicula-fluminea",
      "53023:corbicula-fluminea",
      "53025:corbicula-fluminea",
      "53027:corbicula-fluminea",
      "53029:corbicula-fluminea",
      "53031:corbicula-fluminea",
      "53033:corbicula-fluminea",
      "53035:corbicula-fluminea",
      "53037:corbicula-fluminea",
      "53039:corbicula-fluminea",
      "53041:corbicula-fluminea",
      "53043:corbicula-fluminea",
      "53045:corbicula-fluminea",
      "53047:corbicula-fluminea",
      "53049:corbicula-fluminea",
      "53051:corbicula-fluminea",
      "53053:corbicula-fluminea",
      "53055:corbicula-fluminea",
      "53057:corbicula-fluminea",
      "53059:corbicula-fluminea",
      "53061:corbicula-fluminea",
      "53063:corbicula-fluminea",
      "53065:corbicula-fluminea",
      "53067:corbicula-fluminea",
      "53069:corbicula-fluminea",
      "53071:corbicula-fluminea",
      "53073:corbicula-fluminea",
      "53075:corbicula-fluminea",
      "53077:corbicula-fluminea"
    ],
    "acceptedOccurrenceStatuses": [
      "collected",
      "established"
    ]
  },
  "requested_scope": {
    "state_code": "WA",
    "county_fips": [
      "53001",
      "53003",
      "53005",
      "53007",
      "53009",
      "53011",
      "53013",
      "53015",
      "53017",
      "53019",
      "53021",
      "53023",
      "53025",
      "53027",
      "53029",
      "53031",
      "53033",
      "53035",
      "53037",
      "53039",
      "53041",
      "53043",
      "53045",
      "53047",
      "53049",
      "53051",
      "53053",
      "53055",
      "53057",
      "53059",
      "53061",
      "53063",
      "53065",
      "53067",
      "53069",
      "53071",
      "53073",
      "53075",
      "53077"
    ],
    "species_ids": [
      "corbicula-fluminea"
    ],
    "pair_keys": [
      "53001:corbicula-fluminea",
      "53003:corbicula-fluminea",
      "53005:corbicula-fluminea",
      "53007:corbicula-fluminea",
      "53009:corbicula-fluminea",
      "53011:corbicula-fluminea",
      "53013:corbicula-fluminea",
      "53015:corbicula-fluminea",
      "53017:corbicula-fluminea",
      "53019:corbicula-fluminea",
      "53021:corbicula-fluminea",
      "53023:corbicula-fluminea",
      "53025:corbicula-fluminea",
      "53027:corbicula-fluminea",
      "53029:corbicula-fluminea",
      "53031:corbicula-fluminea",
      "53033:corbicula-fluminea",
      "53035:corbicula-fluminea",
      "53037:corbicula-fluminea",
      "53039:corbicula-fluminea",
      "53041:corbicula-fluminea",
      "53043:corbicula-fluminea",
      "53045:corbicula-fluminea",
      "53047:corbicula-fluminea",
      "53049:corbicula-fluminea",
      "53051:corbicula-fluminea",
      "53053:corbicula-fluminea",
      "53055:corbicula-fluminea",
      "53057:corbicula-fluminea",
      "53059:corbicula-fluminea",
      "53061:corbicula-fluminea",
      "53063:corbicula-fluminea",
      "53065:corbicula-fluminea",
      "53067:corbicula-fluminea",
      "53069:corbicula-fluminea",
      "53071:corbicula-fluminea",
      "53073:corbicula-fluminea",
      "53075:corbicula-fluminea",
      "53077:corbicula-fluminea"
    ],
    "date_range": {
      "start": null,
      "end": null
    }
  },
  "upstream_requests": [],
  "artifacts": [
    {
      "path": "src/data/research/runs/20260716T092904000Z__usgs-nas__a29ec4b24d48/artifacts/national-acquisition-reference.json",
      "sha256": "275f3779bfe63d6a02cf4781ef6ea0b7403673c2ed93ca22e006098f59faa84d",
      "bytes": 1805,
      "media_type": "application/json"
    }
  ],
  "outputs": [
    {
      "path": "src/data/research/runs/20260716T092904000Z__usgs-nas__a29ec4b24d48/assertions.ndjson",
      "sha256": "13601d7ec4664860caf856afecfc3cc9e232514025afe5c6a6cef2af20712b74",
      "bytes": 81048,
      "media_type": "application/x-ndjson"
    },
    {
      "path": "src/data/research/runs/20260716T092904000Z__usgs-nas__a29ec4b24d48/reviews.ndjson",
      "sha256": "c3c4eede244f0796e78ba50aa85ace1186309c7cef21ac8cb538c23d94c28271",
      "bytes": 33110,
      "media_type": "application/x-ndjson"
    },
    {
      "path": "src/data/research/runs/20260716T092904000Z__usgs-nas__a29ec4b24d48/rejections.ndjson",
      "sha256": "2f658aef1ca985d494705de99423ca5075dd6169cd8787f502f432b09073fb3f",
      "bytes": 32186,
      "media_type": "application/x-ndjson"
    },
    {
      "path": "src/data/research/runs/20260716T092904000Z__usgs-nas__a29ec4b24d48/outcomes.ndjson",
      "sha256": "2bb605018ce44b4ca8532c695a1a5ce24093f51c899275a7cdd02a1955771ef7",
      "bytes": 28965,
      "media_type": "application/x-ndjson"
    }
  ],
  "counts": {
    "requested_pairs": 39,
    "candidate_records": 2532,
    "assertion_events": 35,
    "review_events": 35,
    "rejection_records": 36,
    "duplicate_records": 0,
    "error_count": 0,
    "pair_outcomes": 39
  },
  "errors": [],
  "known_caveats": [
    "Spatial occurrence evidence only. Records vary in scale, completeness, population status, and temporal currency.",
    "Only exact collected or established rows passed this bounded plan's positive-evidence gate.",
    "The complete archive screen can support researched-unresolved outcomes but never verified absence or not-detected."
  ],
  "source_warnings": [
    "USGS NAS is an official national occurrence source, but its records remain provisional and heterogeneous.",
    "Rejected raw candidate records: 1159.",
    "No archive result was interpreted as verified absence or survey non-detection."
  ],
  "deviations": [
    "The versioned national archive was acquired once, then streamed locally and partitioned without state-specific network requests.",
    "Qualifying raw records were aggregated to one assertion per county-species pair while every raw row remained in the hash-pinned archive.",
    "The explicit partition recorded-at value is the deterministic logical timestamp for this offline replay and both receipt boundaries."
  ],
  "rerun_command": "npm run research:partition:usgs-nas-national -- --acquisition 20260531__usgs-nas-dwca-v1-344__563b13cbf2f8 --plan usgs-nas-national-v1-wave-05 --states WA --recorded-at 2026-07-16T09:29:04.000Z"
}
