{
  "schemaVersion": 1,
  "run_id": "20260908T235809Z__epa-nrsa-fish-counts__82d756cd23a9",
  "status": "complete",
  "started_at": "2026-09-08T23:58:09.128Z",
  "finished_at": "2026-09-08T23:58:14.689Z",
  "actor_type": "adapter",
  "actor_id": "epa-nrsa-retained-fish-counts@3.0.0",
  "source_id": "epa-nrsa-fish-counts",
  "source_registry_hash": "37539d9b2bc6d47186e69864486e586739e7f140ec549170fe1388d9b9a77e59",
  "adapter_id": "epa-nrsa-retained-fish-counts",
  "adapter_version": "3.0.0",
  "adapter_code_hash": "c0e1a213d6a0985820dd753f74b29fe342688fbc23d8d1ac56d3b954651b188e",
  "code_commit": "b13f943e3ea0f5f71c72e409768335298d399bcb",
  "parameter_hash": "82d756cd23a9caac2cd865f342ab42b5306134e8aa13efe8c0479f38a6fe6200",
  "parameters": {
    "methodReviewPath": "src/data/research/source-method-reviews/epa-nrsa-fish-counts-1314-20260908-r21.json",
    "methodReviewSha256": "247318635d06ed8838df3ef184ef81b0a69812549bb248b7a04745b2ede9e374",
    "mode": "retained-reviewed-fish-counts-1314",
    "stateCode": "NM",
    "candidatePairs": [
      "35005:salmo-trutta",
      "35019:cyprinus-carpio",
      "35045:cyprinus-carpio",
      "35045:salmo-trutta",
      "35047:cyprinus-carpio",
      "35061:cyprinus-carpio"
    ],
    "candidateLimit": 6
  },
  "requested_scope": {
    "state_code": "NM",
    "county_fips": [
      "35005",
      "35019",
      "35045",
      "35047",
      "35061"
    ],
    "species_ids": [
      "cyprinus-carpio",
      "salmo-trutta"
    ],
    "pair_keys": [
      "35005:salmo-trutta",
      "35019:cyprinus-carpio",
      "35045:cyprinus-carpio",
      "35045:salmo-trutta",
      "35047:cyprinus-carpio",
      "35061:cyprinus-carpio"
    ],
    "date_range": {
      "start": null,
      "end": null
    }
  },
  "upstream_requests": [],
  "artifacts": [
    {
      "path": "src/data/research/runs/20260908T235809Z__epa-nrsa-fish-counts__82d756cd23a9/artifacts/epa-nrsa-1314-fish-witnesses.json",
      "sha256": "397a296782f4734f710b7b293ebeed1b20592ad256c0547bd3c84926f62499d1",
      "bytes": 134362,
      "media_type": "application/json"
    }
  ],
  "outputs": [
    {
      "path": "src/data/research/runs/20260908T235809Z__epa-nrsa-fish-counts__82d756cd23a9/assertions.ndjson",
      "sha256": "921549c536ba0a0edb6756f7fd92285d2bd8482d0d8867510025b3d278656836",
      "bytes": 21823,
      "media_type": "application/x-ndjson"
    },
    {
      "path": "src/data/research/runs/20260908T235809Z__epa-nrsa-fish-counts__82d756cd23a9/reviews.ndjson",
      "sha256": "8613cae973fac7c8b0217bd1242bed1fa1748f49ef189ad5ec043f4396e18659",
      "bytes": 5682,
      "media_type": "application/x-ndjson"
    },
    {
      "path": "src/data/research/runs/20260908T235809Z__epa-nrsa-fish-counts__82d756cd23a9/rejections.ndjson",
      "sha256": "01ba4719c80b6fe911b091a7c05124b64eeece964e09c058ef8f9805daca546b",
      "bytes": 1,
      "media_type": "application/x-ndjson"
    },
    {
      "path": "src/data/research/runs/20260908T235809Z__epa-nrsa-fish-counts__82d756cd23a9/outcomes.ndjson",
      "sha256": "75b7fbe2e1e8b9a36136d9e8896ac94f24eacbfef9079a7e1c7853c25ba1af3f",
      "bytes": 5646,
      "media_type": "application/x-ndjson"
    }
  ],
  "counts": {
    "requested_pairs": 6,
    "candidate_records": 10,
    "assertion_events": 6,
    "review_events": 6,
    "rejection_records": 0,
    "duplicate_records": 0,
    "error_count": 0,
    "pair_outcomes": 6
  },
  "errors": [],
  "known_caveats": [
    "Historical species-specific positive fish counts at sampled locations. Partial effort, sampling-frame geography and source-specific holds remain explicit; no absence follows from missing records or sampling flags."
  ],
  "source_warnings": [
    "Historical sampled presence only; retrieval does not establish current persistence, reproduction, establishment, countywide abundance or completeness.",
    "Missing rows, excluded records, repeat visits, effort flags and taxonomic holds never establish absence or non-detection.",
    "Original numeric county codes restore one leading zero only when active county name and primary postal-state identity agree independently. Retired or contradictory geography is not reassigned.",
    "A two-state publisher STATE qualifier is usable only when it exactly equals BORD_RIV and includes the independently matching primary postal state.",
    "Generalized county polygons and source frame coordinates diagnose conflicts. Small boundary offsets alone neither reject exact publisher identity nor assign a different county.",
    "The pinned site CSV contains exactly two original 0xF1 bytes in one Rio Penasco record. Reversible ISO-8859-1 interpretation is local to this file; source bytes, row hashes and line terminators are unchanged.",
    "Independent agent review and machine reconstruction are not individual human specimen verification. Original INDEX_VISIT, NON_NATIVE, anomaly and sampling flags remain retained."
  ],
  "deviations": [],
  "rerun_command": "npm run research:run -- --source epa-nrsa-fish-counts --state NM --candidate-file ops/national-research/plans/epa-nrsa-1314-20260908-r21/NM.json --output-root src/data/research/runs --stage-canonical true --pairs 35005:salmo-trutta,35019:cyprinus-carpio,35045:cyprinus-carpio,35045:salmo-trutta,35047:cyprinus-carpio,35061:cyprinus-carpio"
}
