{
  "schemaVersion": 1,
  "run_id": "20260716T092904000Z__usgs-nas__e34e8f3f4e85",
  "status": "complete",
  "started_at": "2026-07-16T09:29:04.000Z",
  "finished_at": "2026-07-16T09:29:04.000Z",
  "actor_type": "adapter",
  "actor_id": "usgs-nas-archive@1.0.0",
  "source_id": "usgs-nas",
  "source_registry_hash": "3ce14a61baea027f2e5c218f422735db362266906b80bc1edeb714526a65fd1f",
  "adapter_id": "usgs-nas-archive",
  "adapter_version": "1.0.0",
  "adapter_code_hash": "cfcbf64d560adb2d61140eba1f282136c6a4b9f4ff5dd6e0fe61403bac6c32f0",
  "code_commit": "9fda6edc17c95daafb609e1fa3c21654a306fb94",
  "parameter_hash": "763b425d8a5b1bfbe9a2c6493a08f059717810cf1a3fb6f65b6ee6e0f3810539",
  "parameters": {
    "stateCode": "WV",
    "mode": "national-archive-replay",
    "nationalAcquisitionId": "20260531__usgs-nas-dwca-v1-344__563b13cbf2f8",
    "nationalAcquisitionReceiptSha256": "7d3a14c612282d77d8931d5a3b145aa1bcb70831cc7f28d4e57b22142a49ebb9",
    "archiveVersion": "1.344",
    "planId": "usgs-nas-national-v1-wave-05",
    "candidateLimit": 55,
    "candidatePairs": [
      "54001:dreissena-polymorpha",
      "54003:dreissena-polymorpha",
      "54005:dreissena-polymorpha",
      "54007:dreissena-polymorpha",
      "54009:dreissena-polymorpha",
      "54011:dreissena-polymorpha",
      "54013:dreissena-polymorpha",
      "54015:dreissena-polymorpha",
      "54017:dreissena-polymorpha",
      "54019:dreissena-polymorpha",
      "54021:dreissena-polymorpha",
      "54023:dreissena-polymorpha",
      "54025:dreissena-polymorpha",
      "54027:dreissena-polymorpha",
      "54029:dreissena-polymorpha",
      "54031:dreissena-polymorpha",
      "54033:dreissena-polymorpha",
      "54035:dreissena-polymorpha",
      "54037:dreissena-polymorpha",
      "54039:dreissena-polymorpha",
      "54041:dreissena-polymorpha",
      "54043:dreissena-polymorpha",
      "54045:dreissena-polymorpha",
      "54047:dreissena-polymorpha",
      "54049:dreissena-polymorpha",
      "54051:dreissena-polymorpha",
      "54053:dreissena-polymorpha",
      "54055:dreissena-polymorpha",
      "54057:dreissena-polymorpha",
      "54059:dreissena-polymorpha",
      "54061:dreissena-polymorpha",
      "54063:dreissena-polymorpha",
      "54065:dreissena-polymorpha",
      "54067:dreissena-polymorpha",
      "54069:dreissena-polymorpha",
      "54071:dreissena-polymorpha",
      "54073:dreissena-polymorpha",
      "54075:dreissena-polymorpha",
      "54077:dreissena-polymorpha",
      "54079:dreissena-polymorpha",
      "54081:dreissena-polymorpha",
      "54083:dreissena-polymorpha",
      "54085:dreissena-polymorpha",
      "54087:dreissena-polymorpha",
      "54089:dreissena-polymorpha",
      "54091:dreissena-polymorpha",
      "54093:dreissena-polymorpha",
      "54095:dreissena-polymorpha",
      "54097:dreissena-polymorpha",
      "54099:dreissena-polymorpha",
      "54101:dreissena-polymorpha",
      "54103:dreissena-polymorpha",
      "54105:dreissena-polymorpha",
      "54107:dreissena-polymorpha",
      "54109:dreissena-polymorpha"
    ],
    "acceptedOccurrenceStatuses": [
      "collected",
      "established"
    ]
  },
  "requested_scope": {
    "state_code": "WV",
    "county_fips": [
      "54001",
      "54003",
      "54005",
      "54007",
      "54009",
      "54011",
      "54013",
      "54015",
      "54017",
      "54019",
      "54021",
      "54023",
      "54025",
      "54027",
      "54029",
      "54031",
      "54033",
      "54035",
      "54037",
      "54039",
      "54041",
      "54043",
      "54045",
      "54047",
      "54049",
      "54051",
      "54053",
      "54055",
      "54057",
      "54059",
      "54061",
      "54063",
      "54065",
      "54067",
      "54069",
      "54071",
      "54073",
      "54075",
      "54077",
      "54079",
      "54081",
      "54083",
      "54085",
      "54087",
      "54089",
      "54091",
      "54093",
      "54095",
      "54097",
      "54099",
      "54101",
      "54103",
      "54105",
      "54107",
      "54109"
    ],
    "species_ids": [
      "dreissena-polymorpha"
    ],
    "pair_keys": [
      "54001:dreissena-polymorpha",
      "54003:dreissena-polymorpha",
      "54005:dreissena-polymorpha",
      "54007:dreissena-polymorpha",
      "54009:dreissena-polymorpha",
      "54011:dreissena-polymorpha",
      "54013:dreissena-polymorpha",
      "54015:dreissena-polymorpha",
      "54017:dreissena-polymorpha",
      "54019:dreissena-polymorpha",
      "54021:dreissena-polymorpha",
      "54023:dreissena-polymorpha",
      "54025:dreissena-polymorpha",
      "54027:dreissena-polymorpha",
      "54029:dreissena-polymorpha",
      "54031:dreissena-polymorpha",
      "54033:dreissena-polymorpha",
      "54035:dreissena-polymorpha",
      "54037:dreissena-polymorpha",
      "54039:dreissena-polymorpha",
      "54041:dreissena-polymorpha",
      "54043:dreissena-polymorpha",
      "54045:dreissena-polymorpha",
      "54047:dreissena-polymorpha",
      "54049:dreissena-polymorpha",
      "54051:dreissena-polymorpha",
      "54053:dreissena-polymorpha",
      "54055:dreissena-polymorpha",
      "54057:dreissena-polymorpha",
      "54059:dreissena-polymorpha",
      "54061:dreissena-polymorpha",
      "54063:dreissena-polymorpha",
      "54065:dreissena-polymorpha",
      "54067:dreissena-polymorpha",
      "54069:dreissena-polymorpha",
      "54071:dreissena-polymorpha",
      "54073:dreissena-polymorpha",
      "54075:dreissena-polymorpha",
      "54077:dreissena-polymorpha",
      "54079:dreissena-polymorpha",
      "54081:dreissena-polymorpha",
      "54083:dreissena-polymorpha",
      "54085:dreissena-polymorpha",
      "54087:dreissena-polymorpha",
      "54089:dreissena-polymorpha",
      "54091:dreissena-polymorpha",
      "54093:dreissena-polymorpha",
      "54095:dreissena-polymorpha",
      "54097:dreissena-polymorpha",
      "54099:dreissena-polymorpha",
      "54101:dreissena-polymorpha",
      "54103:dreissena-polymorpha",
      "54105:dreissena-polymorpha",
      "54107:dreissena-polymorpha",
      "54109:dreissena-polymorpha"
    ],
    "date_range": {
      "start": null,
      "end": null
    }
  },
  "upstream_requests": [],
  "artifacts": [
    {
      "path": "src/data/research/runs/20260716T092904000Z__usgs-nas__e34e8f3f4e85/artifacts/national-acquisition-reference.json",
      "sha256": "1f3f0a9fdfbc104826b96189f204b7868550a2032085b22833384d015cd4a1ea",
      "bytes": 1799,
      "media_type": "application/json"
    }
  ],
  "outputs": [
    {
      "path": "src/data/research/runs/20260716T092904000Z__usgs-nas__e34e8f3f4e85/assertions.ndjson",
      "sha256": "cb71b48c1c6e7149fbdd286c4aa353d25c95588133c48dce1f049901d293bfef",
      "bytes": 23127,
      "media_type": "application/x-ndjson"
    },
    {
      "path": "src/data/research/runs/20260716T092904000Z__usgs-nas__e34e8f3f4e85/reviews.ndjson",
      "sha256": "576aa1735d856572ebe6b42b857badcddf20a97dc32d5a3d13e30284a4a222dc",
      "bytes": 9480,
      "media_type": "application/x-ndjson"
    },
    {
      "path": "src/data/research/runs/20260716T092904000Z__usgs-nas__e34e8f3f4e85/rejections.ndjson",
      "sha256": "336e4e0cd75e66933204019e828c595e533e67a787bdee1737e020767c5ad98a",
      "bytes": 1647,
      "media_type": "application/x-ndjson"
    },
    {
      "path": "src/data/research/runs/20260716T092904000Z__usgs-nas__e34e8f3f4e85/outcomes.ndjson",
      "sha256": "07466aed258d819175ffff07708ae84bc73666f96c080701953d1b658ba3cf9e",
      "bytes": 36325,
      "media_type": "application/x-ndjson"
    }
  ],
  "counts": {
    "requested_pairs": 55,
    "candidate_records": 110,
    "assertion_events": 10,
    "review_events": 10,
    "rejection_records": 2,
    "duplicate_records": 0,
    "error_count": 0,
    "pair_outcomes": 55
  },
  "errors": [],
  "known_caveats": [
    "Spatial occurrence evidence only. Records vary in scale, completeness, population status, and temporal currency.",
    "Only exact collected or established rows passed this bounded plan's positive-evidence gate.",
    "The complete archive screen can support researched-unresolved outcomes but never verified absence or not-detected."
  ],
  "source_warnings": [
    "USGS NAS is an official national occurrence source, but its records remain provisional and heterogeneous.",
    "Rejected raw candidate records: 3.",
    "No archive result was interpreted as verified absence or survey non-detection."
  ],
  "deviations": [
    "The versioned national archive was acquired once, then streamed locally and partitioned without state-specific network requests.",
    "Qualifying raw records were aggregated to one assertion per county-species pair while every raw row remained in the hash-pinned archive.",
    "The explicit partition recorded-at value is the deterministic logical timestamp for this offline replay and both receipt boundaries."
  ],
  "rerun_command": "npm run research:partition:usgs-nas-national -- --acquisition 20260531__usgs-nas-dwca-v1-344__563b13cbf2f8 --plan usgs-nas-national-v1-wave-05 --states WV --recorded-at 2026-07-16T09:29:04.000Z"
}
