{
  "schemaVersion": 1,
  "run_id": "20260908T102555Z__aphis-honey-bee__c891c4c8cb0b",
  "status": "complete",
  "started_at": "2026-09-08T10:25:55.194Z",
  "finished_at": "2026-09-08T10:25:58.201Z",
  "actor_type": "adapter",
  "actor_id": "aphis-honey-bee-survey@2.0.0",
  "source_id": "aphis-honey-bee",
  "source_registry_hash": "8d58bb9ed12579b52820da3e305c16355008163718cee4928c63f1366b09a575",
  "adapter_id": "aphis-honey-bee-survey",
  "adapter_version": "2.0.0",
  "adapter_code_hash": "a23f15f7158859be034d00e5614e8dd338392a3c5f193a51e7d9ea4ee3094dfe",
  "code_commit": "b2545bae5ee6dec7b7a5f3e5c6339abf800d36e0",
  "parameter_hash": "c891c4c8cb0b540fd5d723c8a436b44bbd09ac2821b1755ee0b0cce75bdab937",
  "parameters": {
    "methodReviewSha256": "e8f8f388459d3a0b197284da241312a6b0725db89cc79b50e5b1d570ec51a51c",
    "mode": "retained-positive-survey",
    "stateCode": "MT",
    "candidatePairs": [
      "30001:varroa-destructor",
      "30003:varroa-destructor",
      "30005:varroa-destructor",
      "30007:varroa-destructor",
      "30009:varroa-destructor",
      "30013:varroa-destructor",
      "30015:varroa-destructor",
      "30017:varroa-destructor",
      "30025:varroa-destructor",
      "30027:varroa-destructor",
      "30029:varroa-destructor",
      "30031:varroa-destructor",
      "30033:varroa-destructor",
      "30035:varroa-destructor",
      "30037:varroa-destructor",
      "30041:varroa-destructor",
      "30043:varroa-destructor",
      "30045:varroa-destructor",
      "30047:varroa-destructor",
      "30049:varroa-destructor",
      "30053:varroa-destructor",
      "30057:varroa-destructor",
      "30059:varroa-destructor",
      "30061:varroa-destructor",
      "30063:varroa-destructor",
      "30065:varroa-destructor",
      "30067:varroa-destructor",
      "30071:varroa-destructor",
      "30073:varroa-destructor",
      "30075:varroa-destructor",
      "30077:varroa-destructor",
      "30081:varroa-destructor",
      "30083:varroa-destructor",
      "30085:varroa-destructor",
      "30087:varroa-destructor",
      "30089:varroa-destructor",
      "30091:varroa-destructor",
      "30095:varroa-destructor",
      "30097:varroa-destructor",
      "30099:varroa-destructor",
      "30101:varroa-destructor",
      "30109:varroa-destructor",
      "30111:varroa-destructor"
    ],
    "candidateLimit": 43
  },
  "requested_scope": {
    "state_code": "MT",
    "county_fips": [
      "30001",
      "30003",
      "30005",
      "30007",
      "30009",
      "30013",
      "30015",
      "30017",
      "30025",
      "30027",
      "30029",
      "30031",
      "30033",
      "30035",
      "30037",
      "30041",
      "30043",
      "30045",
      "30047",
      "30049",
      "30053",
      "30057",
      "30059",
      "30061",
      "30063",
      "30065",
      "30067",
      "30071",
      "30073",
      "30075",
      "30077",
      "30081",
      "30083",
      "30085",
      "30087",
      "30089",
      "30091",
      "30095",
      "30097",
      "30099",
      "30101",
      "30109",
      "30111"
    ],
    "species_ids": [
      "varroa-destructor"
    ],
    "pair_keys": [
      "30001:varroa-destructor",
      "30003:varroa-destructor",
      "30005:varroa-destructor",
      "30007:varroa-destructor",
      "30009:varroa-destructor",
      "30013:varroa-destructor",
      "30015:varroa-destructor",
      "30017:varroa-destructor",
      "30025:varroa-destructor",
      "30027:varroa-destructor",
      "30029:varroa-destructor",
      "30031:varroa-destructor",
      "30033:varroa-destructor",
      "30035:varroa-destructor",
      "30037:varroa-destructor",
      "30041:varroa-destructor",
      "30043:varroa-destructor",
      "30045:varroa-destructor",
      "30047:varroa-destructor",
      "30049:varroa-destructor",
      "30053:varroa-destructor",
      "30057:varroa-destructor",
      "30059:varroa-destructor",
      "30061:varroa-destructor",
      "30063:varroa-destructor",
      "30065:varroa-destructor",
      "30067:varroa-destructor",
      "30071:varroa-destructor",
      "30073:varroa-destructor",
      "30075:varroa-destructor",
      "30077:varroa-destructor",
      "30081:varroa-destructor",
      "30083:varroa-destructor",
      "30085:varroa-destructor",
      "30087:varroa-destructor",
      "30089:varroa-destructor",
      "30091:varroa-destructor",
      "30095:varroa-destructor",
      "30097:varroa-destructor",
      "30099:varroa-destructor",
      "30101:varroa-destructor",
      "30109:varroa-destructor",
      "30111:varroa-destructor"
    ],
    "date_range": {
      "start": null,
      "end": null
    }
  },
  "upstream_requests": [],
  "artifacts": [
    {
      "path": "src/data/research/runs/20260908T102555Z__aphis-honey-bee__c891c4c8cb0b/artifacts/honey-bee-positive-witnesses.json",
      "sha256": "01b3c96b60fb71ff9822260fe30857d999d148f75cb72d703af8c126f80c5a8f",
      "bytes": 341078,
      "media_type": "application/json"
    }
  ],
  "outputs": [
    {
      "path": "src/data/research/runs/20260908T102555Z__aphis-honey-bee__c891c4c8cb0b/assertions.ndjson",
      "sha256": "631ce2af8485fecb4099a7fad4c0f4d298313058ccb4d012c2ddf4c858f3b3e2",
      "bytes": 180100,
      "media_type": "application/x-ndjson"
    },
    {
      "path": "src/data/research/runs/20260908T102555Z__aphis-honey-bee__c891c4c8cb0b/reviews.ndjson",
      "sha256": "91dfb09a6df8591a9034d744ccb49112c791e50ad172db4271baae8b5d92530b",
      "bytes": 42226,
      "media_type": "application/x-ndjson"
    },
    {
      "path": "src/data/research/runs/20260908T102555Z__aphis-honey-bee__c891c4c8cb0b/rejections.ndjson",
      "sha256": "43fc3c3109dfde724340a181f07cc3f73e89c0585b39bb56262d9ab1b37fb751",
      "bytes": 33866,
      "media_type": "application/x-ndjson"
    },
    {
      "path": "src/data/research/runs/20260908T102555Z__aphis-honey-bee__c891c4c8cb0b/outcomes.ndjson",
      "sha256": "fb75b4bd96223b5a085a7bb60b8900e7e19a74ed7832d205a4feb0686d086048",
      "bytes": 36205,
      "media_type": "application/x-ndjson"
    }
  ],
  "counts": {
    "requested_pairs": 43,
    "candidate_records": 320,
    "assertion_events": 43,
    "review_events": 43,
    "rejection_records": 34,
    "duplicate_records": 0,
    "error_count": 0,
    "pair_outcomes": 43
  },
  "errors": [],
  "known_caveats": [
    "Zero-count rows support sample-level non-detection only, never countywide absence. Version 2.0.0 replays positive Varroa metrics from the retained public composite-apiary survey; source-specific program mapping, managed-host and migratory context, month precision, UMD attribution, and explicit Hawaii conflict holds are mandatory. It does not infer countywide establishment, persistence, absence or non-detection."
  ],
  "source_warnings": [
    "Composite apiary samples pool eight managed honey bee colonies; a positive result does not mean all eight colonies were infested.",
    "The parasite was detected in a managed-host sampling context. Wild establishment, local acquisition, countywide prevalence and persistence today are not established.",
    "Migratory and stationary operations participated; individual public rows do not disclose migration history or apiary identifiers.",
    "The metric is mites per 100 bees, not a raw mite count. No sample denominator is available to reconstruct a raw count.",
    "The CSV metric is mapped at program level to Varroa destructor using the official 2016-2017 report; raw rows do not literally name the species. The 2025 plan uses Varroa spp. wording.",
    "Publisher county text comes from its 2020 TIGER/Line assignment; no coordinates or automatic retired-county successor assignment are used here.",
    "Collection month precision is preserved. Export, acquisition and review timestamps are separate.",
    "Zero, blank, invalid, ambiguous and held records create no positive or negative claim. A completed selected source screen does not certify a county or complete its research protocol.",
    "Anonymous rows are retained by immutable archive and exact row locator. Similar or identical disclosed fields cannot prove that two sampling events are identical."
  ],
  "deviations": [],
  "rerun_command": "npm run research:run -- --source aphis-honey-bee --state MT --candidate-file ops/national-research/plans/honey-bee-positive-20260908-r12/mt.json --output-root src/data/research/runs --stage-canonical true --pairs 30001:varroa-destructor,30003:varroa-destructor,30005:varroa-destructor,30007:varroa-destructor,30009:varroa-destructor,30013:varroa-destructor,30015:varroa-destructor,30017:varroa-destructor,30025:varroa-destructor,30027:varroa-destructor,30029:varroa-destructor,30031:varroa-destructor,30033:varroa-destructor,30035:varroa-destructor,30037:varroa-destructor,30041:varroa-destructor,30043:varroa-destructor,30045:varroa-destructor,30047:varroa-destructor,30049:varroa-destructor,30053:varroa-destructor,30057:varroa-destructor,30059:varroa-destructor,30061:varroa-destructor,30063:varroa-destructor,30065:varroa-destructor,30067:varroa-destructor,30071:varroa-destructor,30073:varroa-destructor,30075:varroa-destructor,30077:varroa-destructor,30081:varroa-destructor,30083:varroa-destructor,30085:varroa-destructor,30087:varroa-destructor,30089:varroa-destructor,30091:varroa-destructor,30095:varroa-destructor,30097:varroa-destructor,30099:varroa-destructor,30101:varroa-destructor,30109:varroa-destructor,30111:varroa-destructor"
}
