{
  "schemaVersion": 1,
  "run_id": "20260819T041411Z__gbif-preserved-specimens__adbbc8074cee",
  "status": "complete",
  "started_at": "2026-08-19T04:14:11.751Z",
  "finished_at": "2026-08-19T04:16:45.084Z",
  "actor_type": "adapter",
  "actor_id": "gbif-preserved-specimens@1.4.0",
  "source_id": "gbif-preserved-specimens",
  "source_registry_hash": "0f5e3b5a38c68185f1f73382bfce4c21c1a0e8e460d94759058ebbc855770f60",
  "adapter_id": "gbif-preserved-specimens",
  "adapter_version": "1.4.0",
  "adapter_code_hash": "7d076ab671d917fbcacc4c051f25266153f11d2b6cb80280b06dd1e7aec2e2a5",
  "code_commit": "73ae36e2cd53a20a908d9e5a7eae13dc25f55c4c",
  "parameter_hash": "67175066d22f623f08a54c3b975504c58a11bb97afd29fed22f90c8fe12d45f3",
  "parameters": {
    "stateCode": "DE",
    "stateProvince": "Delaware",
    "candidateLimit": 24,
    "candidatePairs": [
      "10001:alnus-glutinosa",
      "10001:anthriscus-sylvestris",
      "10001:epilobium-hirsutum",
      "10001:impatiens-glandulifera",
      "10001:ligustrum-obtusifolium",
      "10001:lysimachia-vulgaris",
      "10001:mylopharyngodon-piceus",
      "10001:persicaria-perfoliata",
      "10003:alnus-glutinosa",
      "10003:anthriscus-sylvestris",
      "10003:epilobium-hirsutum",
      "10003:impatiens-glandulifera",
      "10003:ligustrum-obtusifolium",
      "10003:lysimachia-vulgaris",
      "10003:mylopharyngodon-piceus",
      "10003:persicaria-perfoliata",
      "10005:alnus-glutinosa",
      "10005:anthriscus-sylvestris",
      "10005:epilobium-hirsutum",
      "10005:impatiens-glandulifera",
      "10005:ligustrum-obtusifolium",
      "10005:lysimachia-vulgaris",
      "10005:mylopharyngodon-piceus",
      "10005:persicaria-perfoliata"
    ],
    "basisOfRecord": "PRESERVED_SPECIMEN",
    "occurrenceStatus": "PRESENT",
    "minimumMatchConfidence": 95,
    "pageLimit": 300
  },
  "requested_scope": {
    "state_code": "DE",
    "county_fips": [
      "10001",
      "10003",
      "10005"
    ],
    "species_ids": [
      "alnus-glutinosa",
      "anthriscus-sylvestris",
      "epilobium-hirsutum",
      "impatiens-glandulifera",
      "ligustrum-obtusifolium",
      "lysimachia-vulgaris",
      "mylopharyngodon-piceus",
      "persicaria-perfoliata"
    ],
    "pair_keys": [
      "10001:alnus-glutinosa",
      "10001:anthriscus-sylvestris",
      "10001:epilobium-hirsutum",
      "10001:impatiens-glandulifera",
      "10001:ligustrum-obtusifolium",
      "10001:lysimachia-vulgaris",
      "10001:mylopharyngodon-piceus",
      "10001:persicaria-perfoliata",
      "10003:alnus-glutinosa",
      "10003:anthriscus-sylvestris",
      "10003:epilobium-hirsutum",
      "10003:impatiens-glandulifera",
      "10003:ligustrum-obtusifolium",
      "10003:lysimachia-vulgaris",
      "10003:mylopharyngodon-piceus",
      "10003:persicaria-perfoliata",
      "10005:alnus-glutinosa",
      "10005:anthriscus-sylvestris",
      "10005:epilobium-hirsutum",
      "10005:impatiens-glandulifera",
      "10005:ligustrum-obtusifolium",
      "10005:lysimachia-vulgaris",
      "10005:mylopharyngodon-piceus",
      "10005:persicaria-perfoliata"
    ],
    "date_range": {
      "start": null,
      "end": null
    }
  },
  "upstream_requests": [
    {
      "url": "https://api.gbif.org/v1/occurrence/download/request/0023571-260806074905277.zip",
      "status": 200,
      "retrieved_at": "2026-08-19T04:16:34.721Z",
      "record_count": 4986
    }
  ],
  "artifacts": [
    {
      "path": "src/data/research/runs/20260819T041411Z__gbif-preserved-specimens__adbbc8074cee/artifacts/national-acquisition-reference.json",
      "sha256": "8a877d5fb08c9ddffeb6581922b3da93b771ca2e2adcde3aa6ab8b6431d72955",
      "bytes": 15794,
      "media_type": "application/json"
    }
  ],
  "outputs": [
    {
      "path": "src/data/research/runs/20260819T041411Z__gbif-preserved-specimens__adbbc8074cee/assertions.ndjson",
      "sha256": "5045e7b99ab25ecfbf85c15eee6296dbdeb2fc851e5f47a0e8160ae41912104e",
      "bytes": 13049,
      "media_type": "application/x-ndjson"
    },
    {
      "path": "src/data/research/runs/20260819T041411Z__gbif-preserved-specimens__adbbc8074cee/reviews.ndjson",
      "sha256": "4d003d6ad4647fca97579937af5dd6a6e89c63d2808418fcb820c3855a8e0581",
      "bytes": 6835,
      "media_type": "application/x-ndjson"
    },
    {
      "path": "src/data/research/runs/20260819T041411Z__gbif-preserved-specimens__adbbc8074cee/rejections.ndjson",
      "sha256": "07f104c636e94f7f725da90db0b3d57db1ff774bfc3b823772e4c85a5444e716",
      "bytes": 1644,
      "media_type": "application/x-ndjson"
    },
    {
      "path": "src/data/research/runs/20260819T041411Z__gbif-preserved-specimens__adbbc8074cee/outcomes.ndjson",
      "sha256": "87f3c8f83912e6a443aac94deb313683388bed4c32a59f49132ae92587ae1208",
      "bytes": 17558,
      "media_type": "application/x-ndjson"
    },
    {
      "path": "src/data/research/runs/20260819T041411Z__gbif-preserved-specimens__adbbc8074cee/source-verification.json",
      "sha256": "0856a45925f0b8a638485acee2f02d130e1b55f31257042017a589d667c73351",
      "bytes": 4325,
      "media_type": "application/json"
    }
  ],
  "counts": {
    "requested_pairs": 24,
    "candidate_records": 43,
    "assertion_events": 7,
    "review_events": 7,
    "rejection_records": 2,
    "duplicate_records": 0,
    "error_count": 0,
    "pair_outcomes": 24
  },
  "errors": [],
  "known_caveats": [
    "Preserved specimen evidence only. Publisher records can contain taxonomic and geospatial issues.",
    "Complete source silence changes research status only and never establishes absence or non-detection.",
    "Only baseline not-researched pairs are emitted; blocked and already researched pairs remain outside this partition scope."
  ],
  "source_warnings": [
    "Retained 16 exact archive row(s) outside the baseline not-researched selection without emitting duplicate pair outcomes."
  ],
  "deviations": [
    "One authenticated provider-native national DWCA archive is partitioned offline without state or county network requests.",
    "Coordinates are retained as source fields but never used to assign county geography.",
    "One deterministic lowest-GBIF-ID qualifying assertion is emitted per selected pair to bound evidence volume."
  ],
  "rerun_command": "node --import tsx scripts/research/partition-national-gbif-download.ts --plan src/data/research/national-acquisition-plans/gbif-national-download-v2-round-74-9.json --acquisition src/data/research/national-acquisitions/20260819t041411z__gbif-download__172c1735eb7d"
}
