{
  "schemaVersion": 1,
  "run_id": "20260716T092904000Z__usgs-nas__6d77eac911a8",
  "status": "complete",
  "started_at": "2026-07-16T09:29:04.000Z",
  "finished_at": "2026-07-16T09:29:04.000Z",
  "actor_type": "adapter",
  "actor_id": "usgs-nas-archive@1.0.0",
  "source_id": "usgs-nas",
  "source_registry_hash": "3ce14a61baea027f2e5c218f422735db362266906b80bc1edeb714526a65fd1f",
  "adapter_id": "usgs-nas-archive",
  "adapter_version": "1.0.0",
  "adapter_code_hash": "cfcbf64d560adb2d61140eba1f282136c6a4b9f4ff5dd6e0fe61403bac6c32f0",
  "code_commit": "9fda6edc17c95daafb609e1fa3c21654a306fb94",
  "parameter_hash": "b20ac6cfbfc4f0b6123475ae538c24f8747d5065244b0790b2a694718362f866",
  "parameters": {
    "stateCode": "WV",
    "mode": "national-archive-replay",
    "nationalAcquisitionId": "20260531__usgs-nas-dwca-v1-344__563b13cbf2f8",
    "nationalAcquisitionReceiptSha256": "7d3a14c612282d77d8931d5a3b145aa1bcb70831cc7f28d4e57b22142a49ebb9",
    "archiveVersion": "1.344",
    "planId": "usgs-nas-national-v1-wave-05",
    "candidateLimit": 55,
    "candidatePairs": [
      "54001:hypophthalmichthys-nobilis",
      "54003:hypophthalmichthys-nobilis",
      "54005:hypophthalmichthys-nobilis",
      "54007:hypophthalmichthys-nobilis",
      "54009:hypophthalmichthys-nobilis",
      "54011:hypophthalmichthys-nobilis",
      "54013:hypophthalmichthys-nobilis",
      "54015:hypophthalmichthys-nobilis",
      "54017:hypophthalmichthys-nobilis",
      "54019:hypophthalmichthys-nobilis",
      "54021:hypophthalmichthys-nobilis",
      "54023:hypophthalmichthys-nobilis",
      "54025:hypophthalmichthys-nobilis",
      "54027:hypophthalmichthys-nobilis",
      "54029:hypophthalmichthys-nobilis",
      "54031:hypophthalmichthys-nobilis",
      "54033:hypophthalmichthys-nobilis",
      "54035:hypophthalmichthys-nobilis",
      "54037:hypophthalmichthys-nobilis",
      "54039:hypophthalmichthys-nobilis",
      "54041:hypophthalmichthys-nobilis",
      "54043:hypophthalmichthys-nobilis",
      "54045:hypophthalmichthys-nobilis",
      "54047:hypophthalmichthys-nobilis",
      "54049:hypophthalmichthys-nobilis",
      "54051:hypophthalmichthys-nobilis",
      "54053:hypophthalmichthys-nobilis",
      "54055:hypophthalmichthys-nobilis",
      "54057:hypophthalmichthys-nobilis",
      "54059:hypophthalmichthys-nobilis",
      "54061:hypophthalmichthys-nobilis",
      "54063:hypophthalmichthys-nobilis",
      "54065:hypophthalmichthys-nobilis",
      "54067:hypophthalmichthys-nobilis",
      "54069:hypophthalmichthys-nobilis",
      "54071:hypophthalmichthys-nobilis",
      "54073:hypophthalmichthys-nobilis",
      "54075:hypophthalmichthys-nobilis",
      "54077:hypophthalmichthys-nobilis",
      "54079:hypophthalmichthys-nobilis",
      "54081:hypophthalmichthys-nobilis",
      "54083:hypophthalmichthys-nobilis",
      "54085:hypophthalmichthys-nobilis",
      "54087:hypophthalmichthys-nobilis",
      "54089:hypophthalmichthys-nobilis",
      "54091:hypophthalmichthys-nobilis",
      "54093:hypophthalmichthys-nobilis",
      "54095:hypophthalmichthys-nobilis",
      "54097:hypophthalmichthys-nobilis",
      "54099:hypophthalmichthys-nobilis",
      "54101:hypophthalmichthys-nobilis",
      "54103:hypophthalmichthys-nobilis",
      "54105:hypophthalmichthys-nobilis",
      "54107:hypophthalmichthys-nobilis",
      "54109:hypophthalmichthys-nobilis"
    ],
    "acceptedOccurrenceStatuses": [
      "collected",
      "established"
    ]
  },
  "requested_scope": {
    "state_code": "WV",
    "county_fips": [
      "54001",
      "54003",
      "54005",
      "54007",
      "54009",
      "54011",
      "54013",
      "54015",
      "54017",
      "54019",
      "54021",
      "54023",
      "54025",
      "54027",
      "54029",
      "54031",
      "54033",
      "54035",
      "54037",
      "54039",
      "54041",
      "54043",
      "54045",
      "54047",
      "54049",
      "54051",
      "54053",
      "54055",
      "54057",
      "54059",
      "54061",
      "54063",
      "54065",
      "54067",
      "54069",
      "54071",
      "54073",
      "54075",
      "54077",
      "54079",
      "54081",
      "54083",
      "54085",
      "54087",
      "54089",
      "54091",
      "54093",
      "54095",
      "54097",
      "54099",
      "54101",
      "54103",
      "54105",
      "54107",
      "54109"
    ],
    "species_ids": [
      "hypophthalmichthys-nobilis"
    ],
    "pair_keys": [
      "54001:hypophthalmichthys-nobilis",
      "54003:hypophthalmichthys-nobilis",
      "54005:hypophthalmichthys-nobilis",
      "54007:hypophthalmichthys-nobilis",
      "54009:hypophthalmichthys-nobilis",
      "54011:hypophthalmichthys-nobilis",
      "54013:hypophthalmichthys-nobilis",
      "54015:hypophthalmichthys-nobilis",
      "54017:hypophthalmichthys-nobilis",
      "54019:hypophthalmichthys-nobilis",
      "54021:hypophthalmichthys-nobilis",
      "54023:hypophthalmichthys-nobilis",
      "54025:hypophthalmichthys-nobilis",
      "54027:hypophthalmichthys-nobilis",
      "54029:hypophthalmichthys-nobilis",
      "54031:hypophthalmichthys-nobilis",
      "54033:hypophthalmichthys-nobilis",
      "54035:hypophthalmichthys-nobilis",
      "54037:hypophthalmichthys-nobilis",
      "54039:hypophthalmichthys-nobilis",
      "54041:hypophthalmichthys-nobilis",
      "54043:hypophthalmichthys-nobilis",
      "54045:hypophthalmichthys-nobilis",
      "54047:hypophthalmichthys-nobilis",
      "54049:hypophthalmichthys-nobilis",
      "54051:hypophthalmichthys-nobilis",
      "54053:hypophthalmichthys-nobilis",
      "54055:hypophthalmichthys-nobilis",
      "54057:hypophthalmichthys-nobilis",
      "54059:hypophthalmichthys-nobilis",
      "54061:hypophthalmichthys-nobilis",
      "54063:hypophthalmichthys-nobilis",
      "54065:hypophthalmichthys-nobilis",
      "54067:hypophthalmichthys-nobilis",
      "54069:hypophthalmichthys-nobilis",
      "54071:hypophthalmichthys-nobilis",
      "54073:hypophthalmichthys-nobilis",
      "54075:hypophthalmichthys-nobilis",
      "54077:hypophthalmichthys-nobilis",
      "54079:hypophthalmichthys-nobilis",
      "54081:hypophthalmichthys-nobilis",
      "54083:hypophthalmichthys-nobilis",
      "54085:hypophthalmichthys-nobilis",
      "54087:hypophthalmichthys-nobilis",
      "54089:hypophthalmichthys-nobilis",
      "54091:hypophthalmichthys-nobilis",
      "54093:hypophthalmichthys-nobilis",
      "54095:hypophthalmichthys-nobilis",
      "54097:hypophthalmichthys-nobilis",
      "54099:hypophthalmichthys-nobilis",
      "54101:hypophthalmichthys-nobilis",
      "54103:hypophthalmichthys-nobilis",
      "54105:hypophthalmichthys-nobilis",
      "54107:hypophthalmichthys-nobilis",
      "54109:hypophthalmichthys-nobilis"
    ],
    "date_range": {
      "start": null,
      "end": null
    }
  },
  "upstream_requests": [],
  "artifacts": [
    {
      "path": "src/data/research/runs/20260716T092904000Z__usgs-nas__6d77eac911a8/artifacts/national-acquisition-reference.json",
      "sha256": "2acdd764891c9c911c4e0e8850001d65ba59524b826d9a53b24b474a2fb904cb",
      "bytes": 1806,
      "media_type": "application/json"
    }
  ],
  "outputs": [
    {
      "path": "src/data/research/runs/20260716T092904000Z__usgs-nas__6d77eac911a8/assertions.ndjson",
      "sha256": "6ab944bee468a19fc78f4439b6ea647c7e7264f745adb8f086629e2f00efe313",
      "bytes": 2304,
      "media_type": "application/x-ndjson"
    },
    {
      "path": "src/data/research/runs/20260716T092904000Z__usgs-nas__6d77eac911a8/reviews.ndjson",
      "sha256": "40241438e38fa9c934fb17fc35525f6ef0914313722db86ec0182574cbc3cb71",
      "bytes": 954,
      "media_type": "application/x-ndjson"
    },
    {
      "path": "src/data/research/runs/20260716T092904000Z__usgs-nas__6d77eac911a8/rejections.ndjson",
      "sha256": "d2adf2c2f515bfc82986052ebfbc7ac26ab1ad101ed6e6261f97ab7a4a415fbd",
      "bytes": 1722,
      "media_type": "application/x-ndjson"
    },
    {
      "path": "src/data/research/runs/20260716T092904000Z__usgs-nas__6d77eac911a8/outcomes.ndjson",
      "sha256": "a31e380cc52cc540fc0a725ad9a3f3ae4809c7299523686b9bc749408088b07e",
      "bytes": 36754,
      "media_type": "application/x-ndjson"
    }
  ],
  "counts": {
    "requested_pairs": 55,
    "candidate_records": 8,
    "assertion_events": 1,
    "review_events": 1,
    "rejection_records": 2,
    "duplicate_records": 0,
    "error_count": 0,
    "pair_outcomes": 55
  },
  "errors": [],
  "known_caveats": [
    "Spatial occurrence evidence only. Records vary in scale, completeness, population status, and temporal currency.",
    "Only exact collected or established rows passed this bounded plan's positive-evidence gate.",
    "The complete archive screen can support researched-unresolved outcomes but never verified absence or not-detected."
  ],
  "source_warnings": [
    "USGS NAS is an official national occurrence source, but its records remain provisional and heterogeneous.",
    "Rejected raw candidate records: 5.",
    "No archive result was interpreted as verified absence or survey non-detection."
  ],
  "deviations": [
    "The versioned national archive was acquired once, then streamed locally and partitioned without state-specific network requests.",
    "Qualifying raw records were aggregated to one assertion per county-species pair while every raw row remained in the hash-pinned archive.",
    "The explicit partition recorded-at value is the deterministic logical timestamp for this offline replay and both receipt boundaries."
  ],
  "rerun_command": "npm run research:partition:usgs-nas-national -- --acquisition 20260531__usgs-nas-dwca-v1-344__563b13cbf2f8 --plan usgs-nas-national-v1-wave-05 --states WV --recorded-at 2026-07-16T09:29:04.000Z"
}
