{
  "schemaVersion": 1,
  "run_id": "20260716T092902000Z__usgs-nas__9478983d14ed",
  "status": "complete",
  "started_at": "2026-07-16T09:29:02.000Z",
  "finished_at": "2026-07-16T09:29:02.000Z",
  "actor_type": "adapter",
  "actor_id": "usgs-nas-archive@1.0.0",
  "source_id": "usgs-nas",
  "source_registry_hash": "3ce14a61baea027f2e5c218f422735db362266906b80bc1edeb714526a65fd1f",
  "adapter_id": "usgs-nas-archive",
  "adapter_version": "1.0.0",
  "adapter_code_hash": "cfcbf64d560adb2d61140eba1f282136c6a4b9f4ff5dd6e0fe61403bac6c32f0",
  "code_commit": "1b1380ad92eac2e9230bd9a8143a191e8c6e9612",
  "parameter_hash": "91c5fd61517ef98776f81cc2d861281e35026f67df40fc5524d7314d4b3fba94",
  "parameters": {
    "stateCode": "NH",
    "mode": "national-archive-replay",
    "nationalAcquisitionId": "20260531__usgs-nas-dwca-v1-344__563b13cbf2f8",
    "nationalAcquisitionReceiptSha256": "7d3a14c612282d77d8931d5a3b145aa1bcb70831cc7f28d4e57b22142a49ebb9",
    "archiveVersion": "1.344",
    "planId": "usgs-nas-national-v1-wave-03",
    "candidateLimit": 10,
    "candidatePairs": [
      "33001:iris-pseudacorus",
      "33003:iris-pseudacorus",
      "33005:iris-pseudacorus",
      "33007:iris-pseudacorus",
      "33009:iris-pseudacorus",
      "33011:iris-pseudacorus",
      "33013:iris-pseudacorus",
      "33015:iris-pseudacorus",
      "33017:iris-pseudacorus",
      "33019:iris-pseudacorus"
    ],
    "acceptedOccurrenceStatuses": [
      "collected",
      "established"
    ]
  },
  "requested_scope": {
    "state_code": "NH",
    "county_fips": [
      "33001",
      "33003",
      "33005",
      "33007",
      "33009",
      "33011",
      "33013",
      "33015",
      "33017",
      "33019"
    ],
    "species_ids": [
      "iris-pseudacorus"
    ],
    "pair_keys": [
      "33001:iris-pseudacorus",
      "33003:iris-pseudacorus",
      "33005:iris-pseudacorus",
      "33007:iris-pseudacorus",
      "33009:iris-pseudacorus",
      "33011:iris-pseudacorus",
      "33013:iris-pseudacorus",
      "33015:iris-pseudacorus",
      "33017:iris-pseudacorus",
      "33019:iris-pseudacorus"
    ],
    "date_range": {
      "start": null,
      "end": null
    }
  },
  "upstream_requests": [],
  "artifacts": [
    {
      "path": "src/data/research/runs/20260716T092902000Z__usgs-nas__9478983d14ed/artifacts/national-acquisition-reference.json",
      "sha256": "8af3616ea152d08b0aeaaf356b4bb6257ae47274ec0155fa5c33a9ef0f0f0f3f",
      "bytes": 1788,
      "media_type": "application/json"
    }
  ],
  "outputs": [
    {
      "path": "src/data/research/runs/20260716T092902000Z__usgs-nas__9478983d14ed/assertions.ndjson",
      "sha256": "661b7a358c118367956a19d33a862f2a074d38f13644f9f5b3558bf35e1aeae2",
      "bytes": 13571,
      "media_type": "application/x-ndjson"
    },
    {
      "path": "src/data/research/runs/20260716T092902000Z__usgs-nas__9478983d14ed/reviews.ndjson",
      "sha256": "f7b79a43f1ad106860428dc99b5d5ad6cb9ef154dedd1bae383e06f276fe4ffb",
      "bytes": 5664,
      "media_type": "application/x-ndjson"
    },
    {
      "path": "src/data/research/runs/20260716T092902000Z__usgs-nas__9478983d14ed/rejections.ndjson",
      "sha256": "5b8028000fcfb85912e2680ad0b9410a57f29fed3ca48f6613fe40cb8a81d130",
      "bytes": 3271,
      "media_type": "application/x-ndjson"
    },
    {
      "path": "src/data/research/runs/20260716T092902000Z__usgs-nas__9478983d14ed/outcomes.ndjson",
      "sha256": "4e808122b63e551805233979082b4148e5b68dd86f2301f9fe4e2f034ce73ba0",
      "bytes": 6938,
      "media_type": "application/x-ndjson"
    }
  ],
  "counts": {
    "requested_pairs": 10,
    "candidate_records": 20,
    "assertion_events": 6,
    "review_events": 6,
    "rejection_records": 4,
    "duplicate_records": 0,
    "error_count": 0,
    "pair_outcomes": 10
  },
  "errors": [],
  "known_caveats": [
    "Spatial occurrence evidence only. Records vary in scale, completeness, population status, and temporal currency.",
    "Only exact collected or established rows passed this bounded plan's positive-evidence gate.",
    "The complete archive screen can support researched-unresolved outcomes but never verified absence or not-detected."
  ],
  "source_warnings": [
    "USGS NAS is an official national occurrence source, but its records remain provisional and heterogeneous.",
    "Rejected raw candidate records: 6.",
    "No archive result was interpreted as verified absence or survey non-detection."
  ],
  "deviations": [
    "The versioned national archive was acquired once, then streamed locally and partitioned without state-specific network requests.",
    "Qualifying raw records were aggregated to one assertion per county-species pair while every raw row remained in the hash-pinned archive.",
    "The explicit partition recorded-at value is the deterministic logical timestamp for this offline replay and both receipt boundaries."
  ],
  "rerun_command": "npm run research:partition:usgs-nas-national -- --acquisition 20260531__usgs-nas-dwca-v1-344__563b13cbf2f8 --plan usgs-nas-national-v1-wave-03 --states NH --recorded-at 2026-07-16T09:29:02.000Z"
}
